text,label
Bạn hãy cho tôi số liệu về số lượng người hút thuốc tại Việt Nam trong 6 tháng gần đây (tính từ năm 2025),information_seeking
Giá BTC hiện tại là bao nhiêu và BTC sẽ có xu hướng gì trong tương lai,information_seeking
bạn có thể làm gì với file pdf DamQuocDat-WebProgaming-CV.docx.pdf,information_seeking
hãy đọc file này,upload_document
nạp tài liệu CV của tôi,upload_document
learn this pdf file,upload_document
đưa thông tin từ file vào bộ nhớ,upload_document
bạn có thông tin gì thông qua file đó,information_seeking
"Dựa trên portfolio đó thì bạn có thể đưa ra các câu hỏi hổng vấn có thể xoáy sâu vào các dự án có được không, nếu cần thì bạn có thể thông qua các link github này https://github.com/DamDat-coder/DuAnTotNghiep.git và https://github.com/DamDat-coder/ChatBoxRasa.git",information_seeking
"cho tôi hỏi alf bạn có khả năng giải các bài toán cơ bản, hay có khả năng trò chuyện phím với người dùng không",information_seeking
tóm tắt nội dung file này,document_deep_analysis
hãy phân tích kỹ năng của ứng viên trong CV,document_deep_analysis
so sánh kinh nghiệm Web và AI trong tài liệu,document_deep_analysis
đánh giá điểm mạnh và điểm yếu từ file đã nạp,document_deep_analysis
trình bày chi tiết lộ trình học tập của Đạt,document_deep_analysis
giá vàng hôm nay bao nhiêu,web_search_required
tin tức mới nhất về trí tuệ nhân tạo 2026,web_search_required
thời tiết tại Đồng Nai hiện tại thế nào,web_search_required
cập nhật tình hình thị trường chứng khoán,web_search_required
ai là người thắng giải Nobel năm nay,web_search_required
viết code Python cho thuật toán RAG,coding_task
sửa lỗi TypeError trong hàm embed,coding_task
tạo giao diện login bằng Tailwind CSS và React,coding_task
viết script PowerShell để cài đặt thư viện,coding_task
giải thích đoạn code FastAPI này,coding_task
Bạn hãy kể ra tất cả những gì bạn biết về những tin tức chấn động về sàn giao dịch Onus cũng như HanaGold,information_seeking
Tin tức mới nhất về sàn Onus và HanaGold là gì?,information_seeking
Bạn có thể tìm kiếm thông tin gì về tình hình tại eo biển Hormus?,information_seeking
Tin tức mới nhất về tình hình chiến sự tại eo biển Hormus?,information_seeking
"Bạn hãy phân tích sâu hơn về khả năng chiếm đóng, hoặc tỉ lệ phần trăm chiến thắng của Mỹ khi đánh vào eo biển Hormuz",information_seeking
Đảng và nhà nước đã làm như thế nào để có thể bình ổn giá xăng dầu trong tình hình biến động gần đây,information_seeking
"""use client"";  import {   MessagesSquare,   Folder,   Settings,   Sun,   Moon,   Menu,   X,   User,   ChevronDown,   ChevronUp,   PlusCircle,   PanelRight, } from ""lucide-react""; import Link from ""next/link""; import React, { useState, useCallback } from ""react""; import { useTheme } from ""@/hooks/useTheme""; import { useAuth } from ""@/contexts/authContext""; import UserBadge from ""../Core/UserBadge""; import AuthPopup from ""../Core/AuthPopup""; import ConversationList from ""./ConversationList"";  // ✅ IMPORT CUSTOM HOOK MỚI import { useConversationCache } from ""@/hooks/useConversationCache"";  // Khai báo Interface (đã sửa chữa lỗi TS trước đó) interface BaseItem {   label: string;   icon: React.ReactNode;   href?: string;   action?: () => void; }  export default function Sidebar() {   const { theme, toggleTheme } = useTheme();   const { user, logout, isLoadingAuth } = useAuth();    const [open, setOpen] = useState(false);   const [showAuth, setShowAuth] = useState(false);   const [isDropdownOpen, setIsDropdownOpen] = useState(false);   const [isPinned, setIsPinned] = useState(false);   const isAuthInitialized = !isLoadingAuth;    const { conversations, refetchConversations } = useConversationCache(     user?.id || null,     isAuthInitialized,   );    // ✅ SỬ DỤNG useCallback để ổn định hàm đóng Mobile Menu   const closeMobileMenuCallback = useCallback(() => {     setOpen(false);   }, []);    // ✅ SỬ DỤNG useCallback để ổn định hàm toggle dropdown   const handleToggleDropdown = useCallback((): void => {     setIsDropdownOpen((prev) => !prev);   }, []);    // HÀM TYPE GUARD ĐỂ LỌC LINK   const isLinkItem = (item: BaseItem): item is BaseItem & { href: string } => {     return item.href !== undefined;   };    // ✅ KHÔI PHỤC LẠI baseItems và Nút Action   const baseItems: BaseItem[] = [     {       label: ""Cuộc trò chuyện mới"",       icon: <PlusCircle size={20} />,       href: ""/"",       action: () => {         console.log(""Trigger refetching..."");         refetchConversations();         if (open) closeMobileMenuCallback();       },     },     { href: ""/files"", label: ""Tệp"", icon: <Folder size={20} /> },     { href: ""/settings"", label: ""Cài đặt"", icon: <Settings size={20} /> },   ];    const linkItems = baseItems.filter(isLinkItem);   return (     <>       <button         className=""laptop:hidden fixed top-4 left-4 z-50 p-2 rounded-lg bg-gray-50 dark:bg-[#252525] dark:text-black shadow""         onClick={() => setOpen(true)}       >         <Menu size={20} className=""dark:text-white"" />       </button>        {/* ===== Desktop Sidebar ===== */}       <aside         data-expanded={isPinned}         className={`           group fixed h-[95vh] z-50           ${isPinned ? ""w-64"" : ""w-16 hover:w-64""}           bg-white/80 dark:bg-[#1a1a1a]/90 backdrop-blur-xl           border-r border-gray-200 dark:border-white/10            flex-col py-6 m-3 rounded-2xl shadow-xl           transition-[width] duration-300 ease-in-out           hidden laptop:flex overflow-hidden         `}       >         <div className=""flex flex-col gap-2 w-full"">           <div className=""relative flex justify-center items-center h-10"">             <PanelRight               size={20}               onClick={() => setIsPinned((prev) => !prev)}               className=""                 absolute                 transition-all duration-300 ease-in-out                 group-hover:translate-x-24 cursor-pointer                 data-[expanded=true]:right-2               ""               data-pinned={isPinned}             />           </div>           {baseItems.map((item, idx) => {             // Logic xử lý Click (Action hoặc Link)             const handleClick = () => {               if (item.action) item.action();               if (open) closeMobileMenuCallback();             };              const Content = (               <>                 {/* Cố định vùng chứa Icon để không bị lệch khi giãn Sidebar */}                 <div className=""min-w-16 h-10 flex items-center justify-center shrink-0"">                   {item.icon}                 </div>                 {/* Chữ chỉ hiện khi Group Hover */}                 <span className=""text-sm font-medium opacity-0 group-hover:opacity-100 data-[expanded=true]:opacity-100 transition-opacity duration-300 whitespace-nowrap overflow-hidden text-ellipsis mr-4"">                   {item.label}                 </span>               </>             );              return item.href ? (               <Link                 key={idx}                 href={item.href}                 onClick={handleClick}                 className=""flex items-center h-12 mx-0 transition-colors hover:bg-gray-100 dark:hover:bg-white/10 rounded-none group-hover:mx-3 group-data-[expanded=true]:mx-3""               >                 {Content}               </Link>             ) : (               <button                 key={idx}                 onClick={handleClick}                 className=""flex items-center h-12 mx-0 transition-colors hover:bg-gray-100 dark:hover:bg-white/10 rounded-none group-hover:mx-3 group-data-[expanded=true]:mx-3 text-left""               >                 {Content}               </button>             );           })}           {/* MỤC HỘI THOẠI DROPDOWN */}           <div className=""flex flex-col w-full"">             <button               onClick={handleToggleDropdown}               className=""flex items-center h-12 mx-0 transition-colors hover:bg-gray-100 dark:hover:bg-white/10 rounded-none group-hover:mx-3 group-data-[expanded=true]:mx-3 text-left""             >               <div className=""min-w-16 h-10 flex items-center justify-center shrink-0"">                 <MessagesSquare size={20} />               </div>               <div className=""flex items-center justify-between w-full opacity-0 group-hover:opacity-100 data-[expanded=true]:opacity-100 transition-opacity duration-300 mr-4"">                 <span className=""text-sm font-medium whitespace-nowrap"">                   Hội thoại                 </span>                 {isDropdownOpen ? (                   <ChevronUp size={14} />                 ) : (                   <ChevronDown size={14} />                 )}               </div>             </button>              {/* Hiệu ứng trượt Grid mượt mà */}             <div               className={`grid transition-all duration-300 ease-in-out ${isDropdownOpen ? ""grid-rows-[1fr] opacity-100"" : ""grid-rows-[0fr] opacity-0""}`}             >               <div className=""overflow-hidden"">                 <div className=""px-4 py-2 group-data-[expanded=true]:block group-hover:block hidden"">                   {user ? (                     <ConversationList conversations={conversations} />                   ) : (                     <p className=""text-xs opacity-50"">Đăng nhập để xem</p>                   )}                 </div>               </div>             </div>           </div>         </div>          {/* NÚT TOGGLE THEME Ở BOTTOM */}         <button           onClick={toggleTheme}           className=""mt-auto flex items-center h-12 mx-0 transition-colors hover:bg-gray-100 dark:hover:bg-white/10 rounded-none group-hover:mx-3 group-data-[expanded=true]:mx-3""         >           <div className=""min-w-16 h-10 flex items-center justify-center shrink-0"">             {theme === ""light"" ? <Moon size={20} /> : <Sun size={20} />}           </div>           <span className=""text-sm font-medium opacity-0 group-hover:opacity-100 data-[expanded=true]:opacity-100 transition-opacity duration-300 whitespace-nowrap"">             {theme === ""light"" ? ""Dark Mode"" : ""Light Mode""}           </span>         </button>       </aside>        {/* ===== Overlay ===== */}       {open && (         <div           className=""fixed inset-0 bg-black/40 z-40 laptop:hidden""           onClick={() => setOpen(false)}         />       )}        {/* ===== Mobile Slide Menu ===== */}       <div         className={`           fixed top-0 left-0 h-full w-64 z-50            bg-gray-50 dark:bg-[#252525]           border-r border-gray-200 dark:border-gray-700           transition-transform duration-300           ${open ? ""translate-x-0"" : ""-translate-x-full""}           laptop:hidden           flex flex-col         `}       >         <button           className=""absolute top-4 right-4 p-2 rounded-lg hover:bg-gray-200 dark:hover:bg-gray-700""           onClick={() => setOpen(false)}         >           <X size={20} />         </button>          {/* USER SECTION (Mobile) */}         <div className=""flex-1 overflow-y-auto custom-scrollbar"">           <div className=""mt-14 px-4 pb-4"">             {user ? (               <UserBadge />             ) : (               <button                 onClick={() => {                   setOpen(false);                   setShowAuth(true);                 }}                 className=""flex items-center gap-3 bg-gray-100 dark:bg-gray-700 px-3 py-2 rounded-xl w-full""               >                 <User size={20} />                 <span className=""font-medium"">Đăng nhập</span>               </button>             )}           </div>            {/* MENU LIST (Mobile) */}           <div className=""flex flex-col gap-3 px-4"">             {/* CÁC MỤC LINK KHÁC (Mobile) */}             {linkItems.map((item, idx) => (               <Link                 key={idx}                 href={item.href}                 onClick={closeMobileMenuCallback}                 className=""flex items-center gap-3 px-3 py-2 rounded-xl hover:bg-gray-100 dark:hover:bg-gray-700""               >                 {item.icon}                 <span className=""text-sm font-medium"">{item.label}</span>               </Link>             ))}             {/* MỤC HỘI THOẠI VÀ DROPDOWN (Mobile) */}             <div className=""flex flex-col"">               <button                 onClick={() => handleToggleDropdown()}                 className=""flex items-center gap-3 px-3 py-2 rounded-xl hover:bg-gray-100 dark:hover:bg-gray-700 w-full text-left""               >                 <MessagesSquare size={20} />                 <span className=""text-sm font-medium grow"">Hội thoại</span>                 {isDropdownOpen ? (                   <ChevronUp size={16} />                 ) : (                   <ChevronDown size={16} />                 )}               </button>                {/* Danh sách Dropdown (Mobile) */}               <div                 className={`                   grid transition-all duration-300 ease-in-out                   ${isDropdownOpen ? ""grid-rows-[1fr] opacity-100 mt-2"" : ""grid-rows-[0fr] opacity-0""}                 `}               >                 <div className=""overflow-hidden"">                   {user ? (                     <ConversationList conversations={conversations} />                   ) : (                     <p className=""text-xs text-center p-2 opacity-60"">                       Đăng nhập để xem hội thoại                     </p>                   )}                 </div>               </div>             </div>              <div className=""pt-2 flex flex-col gap-2"">               {/* Toggle theme (Mobile) */}               <button                 onClick={() => {                   toggleTheme();                   setOpen(false);                 }}                 className=""flex items-center gap-3 px-3 py-2 rounded-xl hover:bg-gray-100 dark:hover:bg-gray-700""               >                 {theme === ""light"" ? <Moon size={20} /> : <Sun size={20} />}                 <span className=""text-sm font-medium"">                   {theme === ""light"" ? ""Dark Mode"" : ""Light Mode""}                 </span>               </button>                {/* Logout (Mobile) */}               {user && (                 <button                   onClick={() => {                     logout();                     setOpen(false);                   }}                   className=""flex items-center gap-3 px-3 py-2 rounded-xl text-red-500 hover:bg-gray-100 dark:hover:bg-gray-700 mt-auto""                 >                   <User size={20} />                   <span className=""text-sm font-medium"">Đăng xuất</span>                 </button>               )}             </div>           </div>         </div>       </div>        {/* AUTH POPUP */}       <AuthPopup         isOpen={showAuth}         onClose={() => setShowAuth(false)}         onSuccess={() => {           setShowAuth(false);           refetchConversations();         }}       />     </>   ); }",information_seeking
